dataset:
  dataset_name: qm9
  num_outputs: 1
  init:
    _target_: qm9.QM9DataModule
    data_augmentation: false
    name: qm9
    target: 2
    data_dir: ./data
    batch_size_train: 150
    batch_size_inference: 2048
    num_workers: 4
    splits:
    - 0.72
    - 0.08
    - 0.1
    - 0.1
    seed: 0
    subset_size: null
trainer:
  method: semi-supervised-ensemble
  train:
    total_epochs: 350
    validation_interval: 10
  init:
    _target_: trainer.SemiSupervisedEnsemble
    lambda_max: 0.01
    supervised_criterion:
      _target_: torch.nn.MSELoss
    optimizer:
      _target_: torch.optim.AdamW
      _partial_: true
      lr: 0.0001
      weight_decay: 0.01
    scheduler:
      _target_: torch.optim.lr_scheduler.StepLR
      _partial_: true
      step_size: 10
      gamma: 0.9
logger:
  _target_: logger.WandBLogger
  group: ${dataset.dataset_name}
  name: A_gcn_MT_lr0.0001
  job_type: test
  entity: DL-gr82
  project_name: semi-supervised-ensembles
  disable: false
  local_dir: ./logs
model:
  name: advanced_gcn
  init:
    _target_: models.advanced_GCN
    _partial_: false
    num_node_features: 11
    hidden_channels: 128
    dropout: 0.05
    use_layer_norm: false
    use_residual: true
    use_kaiming_init: false
num_models: 1
seed: 0
device: unset
force_deterministic: false
debug_mode: false
result_dir: ./results
compile_model: false

QM9 dataset loaded with 10466 labeled, 94198 unlabeled, 13083 validation, and 13084 test samples.
Batch sizes: labeled=150, unlabeled=150
Supervised batches: 70, Unsupervised batches: 628
tensor(0., device='cuda:0')
tensor(0., device='cuda:0', grad_fn=<MeanBackward0>)

------------------------------------------------------------
Sender: LSF System <lsfadmin@hpc.dtu.dk>
Subject: Job 27242916[1]: <lr[1-3]> in cluster <dcc> Exited

Job <lr[1-3]> was submitted from host <n-62-27-20> by user <s194778> in cluster <dcc> at Mon Dec  1 19:40:49 2025
Job was executed on host(s) <4*n-62-11-16>, in queue <gpuv100>, as user <s194778> in cluster <dcc> at Mon Dec  1 19:46:27 2025
</zhome/f9/1/147385> was used as the home directory.
</zhome/f9/1/147385/02456-g82-dl-project> was used as the working directory.
Started at Mon Dec  1 19:46:27 2025
Terminated at Mon Dec  1 19:57:28 2025
Results reported at Mon Dec  1 19:57:28 2025

Your job looked like:

------------------------------------------------------------
# LSBATCH: User input
#!/bin/bash
# BSUB job array: submit with `bsub < scripts/run_lr_sweep.sh`
# Adjust learning rates in LR_VALUES below.
#BSUB -J lr[1-3]
#BSUB -q gpuv100
#BSUB -W 00:10
#BSUB -n 4
#BSUB -R "span[hosts=1]"
#BSUB -R "rusage[mem=2GB]"
#BSUB -gpu "num=1"
# Time & logs
#BSUB -W 08:00
#BSUB -o /zhome/f9/1/147385/02456-g82-dl-project/hpc_logs/gcn_%J.out
#BSUB -e /zhome/f9/1/147385/02456-g82-dl-project/hpc_logs/gcn_%J.err

set -euo pipefail

module purge
module load python3/3.10.12
module load gcc
# module load cuda/12.1  # uncomment if needed
source "/zhome/f9/1/147385/my_venv/bin/activate"

LR_VALUES=(0.0001 0.001 0.01)
LR=${LR_VALUES[$((LSB_JOBINDEX-1))]}

python3 src/run.py \
    trainer=advanced_gcn_trainer \
    model=advanced_gcn \
    trainer.init.optimizer.lr=$LR \
    logger.name="A_gcn_MT_lr${LR}" \
    "$@"

 # Define the list of lambda_unsup values to sweep
# # LAMBDA_VALUES=(0.001 0.005 0.01 0.05 0.1)
# LAMBDA_VALUES=(0.0001 0.001 0.005 0.01 0.05 0.1)
# LAMBDA=${LAMBDA_VALUES[$((LSB_JOBINDEX-1))]}

# # for LAMBDA in "${LAMBDA_VALUES[@]}"; do
# #     echo "Running experiment with lambda_unsup = $LAMBDA"
# python3 src/run.py \
#     trainer=semi-supervised-ensemble-custom \
#     model=advanced_gcn \
#     trainer.init.lambda_max=$LAMBDA \
#     logger.name="schnet_lambda_${LAMBDA}" \
#     "$@"



------------------------------------------------------------

TERM_RUNLIMIT: job killed after reaching LSF run time limit.
Exited with exit code 140.

Resource usage summary:

    CPU time :                                   1636.00 sec.
    Max Memory :                                 4840 MB
    Average Memory :                             4321.71 MB
    Total Requested Memory :                     8192.00 MB
    Delta Memory :                               3352.00 MB
    Max Swap :                                   -
    Max Processes :                              18
    Max Threads :                                80
    Run time :                                   661 sec.
    Turnaround time :                            999 sec.

The output (if any) is above this job summary.



PS:

Read file </zhome/f9/1/147385/02456-g82-dl-project/hpc_logs/gcn_27242916.err> for stderr output of this job.

dataset:
  dataset_name: qm9
  num_outputs: 1
  init:
    _target_: qm9.QM9DataModule
    data_augmentation: false
    name: qm9
    target: 2
    data_dir: ./data
    batch_size_train: 150
    batch_size_inference: 2048
    num_workers: 4
    splits:
    - 0.72
    - 0.08
    - 0.1
    - 0.1
    seed: 0
    subset_size: null
trainer:
  method: semi-supervised-ensemble
  train:
    total_epochs: 350
    validation_interval: 10
  init:
    _target_: trainer.SemiSupervisedEnsemble
    lambda_max: 0.01
    supervised_criterion:
      _target_: torch.nn.MSELoss
    optimizer:
      _target_: torch.optim.AdamW
      _partial_: true
      lr: 0.001
      weight_decay: 0.01
    scheduler:
      _target_: torch.optim.lr_scheduler.StepLR
      _partial_: true
      step_size: 10
      gamma: 0.9
logger:
  _target_: logger.WandBLogger
  group: ${dataset.dataset_name}
  name: A_gcn_MT_lr0.001
  job_type: test
  entity: DL-gr82
  project_name: Meanest Teacher
  disable: false
  local_dir: ./logs
model:
  name: advanced_gcn
  init:
    _target_: models.advanced_GCN
    _partial_: false
    num_node_features: 11
    hidden_channels: 128
    dropout: 0.05
    use_layer_norm: false
    use_residual: true
    use_kaiming_init: false
num_models: 1
seed: 0
device: unset
force_deterministic: false
debug_mode: false
result_dir: ./results
compile_model: false

QM9 dataset loaded with 10466 labeled, 94198 unlabeled, 13083 validation, and 13084 test samples.
Batch sizes: labeled=150, unlabeled=150
Supervised batches: 70, Unsupervised batches: 628
tensor(0., device='cuda:0')
tensor(0., device='cuda:0', grad_fn=<MeanBackward0>)
dataset:
  dataset_name: qm9
  num_outputs: 1
  init:
    _target_: qm9.QM9DataModule
    data_augmentation: false
    name: qm9
    target: 2
    data_dir: ./data
    batch_size_train: 100
    batch_size_inference: 2048
    num_workers: 4
    splits:
    - 0.72
    - 0.08
    - 0.1
    - 0.1
    seed: 0
    subset_size: null
trainer:
  method: semi-supervised-ensemble
  train:
    total_epochs: 350
    validation_interval: 10
  init:
    _target_: trainer.SemiSupervisedEnsemble
    lambda_max: 0.01
    supervised_criterion:
      _target_: torch.nn.MSELoss
    optimizer:
      _target_: torch.optim.AdamW
      _partial_: true
      lr: 0.01
      weight_decay: 0.01
    scheduler:
      _target_: torch.optim.lr_scheduler.StepLR
      _partial_: true
      step_size: 10
      gamma: 0.9
logger:
  _target_: logger.WandBLogger
  group: ${dataset.dataset_name}
  name: A_gcn_MT_lr0.01
  job_type: test
  entity: DL-gr82
  project_name: Meanest Teacher
  disable: false
  local_dir: ./logs
model:
  name: advanced_gcn
  init:
    _target_: models.advanced_GCN
    _partial_: false
    num_node_features: 11
    hidden_channels: 128
    dropout: 0.05
    use_layer_norm: false
    use_residual: true
    use_kaiming_init: false
num_models: 1
seed: 0
device: unset
force_deterministic: false
debug_mode: false
result_dir: ./results
compile_model: false

QM9 dataset loaded with 10466 labeled, 94198 unlabeled, 13083 validation, and 13084 test samples.
Batch sizes: labeled=100, unlabeled=100
Supervised batches: 105, Unsupervised batches: 942
tensor(0., device='cuda:0')
tensor(0., device='cuda:0', grad_fn=<MeanBackward0>)

------------------------------------------------------------
Sender: LSF System <lsfadmin@hpc.dtu.dk>
Subject: Job 27242916[2]: <lr[1-3]> in cluster <dcc> Exited

Job <lr[1-3]> was submitted from host <n-62-27-20> by user <s194778> in cluster <dcc> at Mon Dec  1 19:40:49 2025
Job was executed on host(s) <4*n-62-11-16>, in queue <gpuv100>, as user <s194778> in cluster <dcc> at Mon Dec  1 19:57:28 2025
</zhome/f9/1/147385> was used as the home directory.
</zhome/f9/1/147385/02456-g82-dl-project> was used as the working directory.
Started at Mon Dec  1 19:57:28 2025
Terminated at Mon Dec  1 20:09:02 2025
Results reported at Mon Dec  1 20:09:02 2025

Your job looked like:

------------------------------------------------------------
# LSBATCH: User input
#!/bin/bash
# BSUB job array: submit with `bsub < scripts/run_lr_sweep.sh`
# Adjust learning rates in LR_VALUES below.
#BSUB -J lr[1-3]
#BSUB -q gpuv100
#BSUB -W 00:10
#BSUB -n 4
#BSUB -R "span[hosts=1]"
#BSUB -R "rusage[mem=2GB]"
#BSUB -gpu "num=1"
# Time & logs
#BSUB -W 08:00
#BSUB -o /zhome/f9/1/147385/02456-g82-dl-project/hpc_logs/gcn_%J.out
#BSUB -e /zhome/f9/1/147385/02456-g82-dl-project/hpc_logs/gcn_%J.err

set -euo pipefail

module purge
module load python3/3.10.12
module load gcc
# module load cuda/12.1  # uncomment if needed
source "/zhome/f9/1/147385/my_venv/bin/activate"

LR_VALUES=(0.0001 0.001 0.01)
LR=${LR_VALUES[$((LSB_JOBINDEX-1))]}

python3 src/run.py \
    trainer=advanced_gcn_trainer \
    model=advanced_gcn \
    trainer.init.optimizer.lr=$LR \
    logger.name="A_gcn_MT_lr${LR}" \
    "$@"

 # Define the list of lambda_unsup values to sweep
# # LAMBDA_VALUES=(0.001 0.005 0.01 0.05 0.1)
# LAMBDA_VALUES=(0.0001 0.001 0.005 0.01 0.05 0.1)
# LAMBDA=${LAMBDA_VALUES[$((LSB_JOBINDEX-1))]}

# # for LAMBDA in "${LAMBDA_VALUES[@]}"; do
# #     echo "Running experiment with lambda_unsup = $LAMBDA"
# python3 src/run.py \
#     trainer=semi-supervised-ensemble-custom \
#     model=advanced_gcn \
#     trainer.init.lambda_max=$LAMBDA \
#     logger.name="schnet_lambda_${LAMBDA}" \
#     "$@"



------------------------------------------------------------

TERM_RUNLIMIT: job killed after reaching LSF run time limit.
Exited with exit code 140.

Resource usage summary:

    CPU time :                                   1717.00 sec.
    Max Memory :                                 4841 MB
    Average Memory :                             4423.50 MB
    Total Requested Memory :                     8192.00 MB
    Delta Memory :                               3351.00 MB
    Max Swap :                                   -
    Max Processes :                              18
    Max Threads :                                80
    Run time :                                   694 sec.
    Turnaround time :                            1693 sec.

The output (if any) is above this job summary.



PS:

Read file </zhome/f9/1/147385/02456-g82-dl-project/hpc_logs/gcn_27242916.err> for stderr output of this job.


------------------------------------------------------------
Sender: LSF System <lsfadmin@hpc.dtu.dk>
Subject: Job 27242916[3]: <lr[1-3]> in cluster <dcc> Exited

Job <lr[1-3]> was submitted from host <n-62-27-20> by user <s194778> in cluster <dcc> at Mon Dec  1 19:40:49 2025
Job was executed on host(s) <4*n-62-20-16>, in queue <gpuv100>, as user <s194778> in cluster <dcc> at Mon Dec  1 20:00:43 2025
</zhome/f9/1/147385> was used as the home directory.
</zhome/f9/1/147385/02456-g82-dl-project> was used as the working directory.
Started at Mon Dec  1 20:00:43 2025
Terminated at Mon Dec  1 20:11:35 2025
Results reported at Mon Dec  1 20:11:35 2025

Your job looked like:

------------------------------------------------------------
# LSBATCH: User input
#!/bin/bash
# BSUB job array: submit with `bsub < scripts/run_lr_sweep.sh`
# Adjust learning rates in LR_VALUES below.
#BSUB -J lr[1-3]
#BSUB -q gpuv100
#BSUB -W 00:10
#BSUB -n 4
#BSUB -R "span[hosts=1]"
#BSUB -R "rusage[mem=2GB]"
#BSUB -gpu "num=1"
# Time & logs
#BSUB -W 08:00
#BSUB -o /zhome/f9/1/147385/02456-g82-dl-project/hpc_logs/gcn_%J.out
#BSUB -e /zhome/f9/1/147385/02456-g82-dl-project/hpc_logs/gcn_%J.err

set -euo pipefail

module purge
module load python3/3.10.12
module load gcc
# module load cuda/12.1  # uncomment if needed
source "/zhome/f9/1/147385/my_venv/bin/activate"

LR_VALUES=(0.0001 0.001 0.01)
LR=${LR_VALUES[$((LSB_JOBINDEX-1))]}

python3 src/run.py \
    trainer=advanced_gcn_trainer \
    model=advanced_gcn \
    trainer.init.optimizer.lr=$LR \
    logger.name="A_gcn_MT_lr${LR}" \
    "$@"

 # Define the list of lambda_unsup values to sweep
# # LAMBDA_VALUES=(0.001 0.005 0.01 0.05 0.1)
# LAMBDA_VALUES=(0.0001 0.001 0.005 0.01 0.05 0.1)
# LAMBDA=${LAMBDA_VALUES[$((LSB_JOBINDEX-1))]}

# # for LAMBDA in "${LAMBDA_VALUES[@]}"; do
# #     echo "Running experiment with lambda_unsup = $LAMBDA"
# python3 src/run.py \
#     trainer=semi-supervised-ensemble-custom \
#     model=advanced_gcn \
#     trainer.init.lambda_max=$LAMBDA \
#     logger.name="schnet_lambda_${LAMBDA}" \
#     "$@"



------------------------------------------------------------

TERM_RUNLIMIT: job killed after reaching LSF run time limit.
Exited with exit code 140.

Resource usage summary:

    CPU time :                                   1566.00 sec.
    Max Memory :                                 4894 MB
    Average Memory :                             3518.87 MB
    Total Requested Memory :                     8192.00 MB
    Delta Memory :                               3298.00 MB
    Max Swap :                                   -
    Max Processes :                              18
    Max Threads :                                79
    Run time :                                   652 sec.
    Turnaround time :                            1846 sec.

The output (if any) is above this job summary.



PS:

Read file </zhome/f9/1/147385/02456-g82-dl-project/hpc_logs/gcn_27242916.err> for stderr output of this job.

