dataset:
  dataset_name: qm9
  num_outputs: 1
  init:
    _target_: qm9.QM9DataModule
    data_augmentation: false
    name: qm9
    target: 2
    data_dir: ./data
    batch_size_train: 50
    batch_size_inference: 2048
    num_workers: 4
    splits:
    - 0.72
    - 0.08
    - 0.1
    - 0.1
    seed: 0
    subset_size: null
trainer:
  method: semi-supervised-ensemble
  train:
    total_epochs: 400
    validation_interval: 10
  init:
    _target_: trainer.SemiSupervisedEnsemble
    lambda_max: 0.05
    supervised_criterion:
      _target_: torch.nn.MSELoss
    optimizer:
      _target_: torch.optim.AdamW
      _partial_: true
      lr: 0.005
      weight_decay: 0.01
    scheduler:
      _target_: torch.optim.lr_scheduler.StepLR
      _partial_: true
      step_size: 10
      gamma: 0.9
logger:
  _target_: logger.WandBLogger
  group: ${dataset.dataset_name}
  name: A_gcn_MT_GraphNorm_batch50
  job_type: test
  entity: DL-gr82
  project_name: Meanest Teacher
  disable: false
  local_dir: ./logs
model:
  name: advanced_gcn
  init:
    _target_: models.advanced_GCN
    _partial_: false
    num_node_features: 11
    hidden_channels: 128
    dropout: 0.05
    use_layer_norm: false
    use_residual: true
    use_kaiming_init: false
num_models: 1
seed: 0
device: unset
force_deterministic: false
debug_mode: false
result_dir: ./results
compile_model: false

QM9 dataset loaded with 10466 labeled, 94198 unlabeled, 13083 validation, and 13084 test samples.
Batch sizes: labeled=50, unlabeled=50
Supervised batches: 210, Unsupervised batches: 1884
tensor(0., device='cuda:0')
tensor(0., device='cuda:0', grad_fn=<MeanBackward0>)
dataset:
  dataset_name: qm9
  num_outputs: 1
  init:
    _target_: qm9.QM9DataModule
    data_augmentation: false
    name: qm9
    target: 2
    data_dir: ./data
    batch_size_train: 150
    batch_size_inference: 2048
    num_workers: 4
    splits:
    - 0.72
    - 0.08
    - 0.1
    - 0.1
    seed: 0
    subset_size: null
trainer:
  method: semi-supervised-ensemble
  train:
    total_epochs: 400
    validation_interval: 10
  init:
    _target_: trainer.SemiSupervisedEnsemble
    lambda_max: 0.05
    supervised_criterion:
      _target_: torch.nn.MSELoss
    optimizer:
      _target_: torch.optim.AdamW
      _partial_: true
      lr: 0.005
      weight_decay: 0.01
    scheduler:
      _target_: torch.optim.lr_scheduler.StepLR
      _partial_: true
      step_size: 10
      gamma: 0.9
logger:
  _target_: logger.WandBLogger
  group: ${dataset.dataset_name}
  name: A_gcn_MT_GraphNorm_batch150
  job_type: test
  entity: DL-gr82
  project_name: Meanest Teacher
  disable: false
  local_dir: ./logs
model:
  name: advanced_gcn
  init:
    _target_: models.advanced_GCN
    _partial_: false
    num_node_features: 11
    hidden_channels: 128
    dropout: 0.05
    use_layer_norm: false
    use_residual: true
    use_kaiming_init: false
num_models: 1
seed: 0
device: unset
force_deterministic: false
debug_mode: false
result_dir: ./results
compile_model: false

QM9 dataset loaded with 10466 labeled, 94198 unlabeled, 13083 validation, and 13084 test samples.
Batch sizes: labeled=150, unlabeled=150
Supervised batches: 70, Unsupervised batches: 628
tensor(0., device='cuda:0')
tensor(0., device='cuda:0', grad_fn=<MeanBackward0>)
[1;34mwandb[0m: 
[1;34mwandb[0m: 🚀 View run [33mA_gcn_MT_GraphNorm_batch150[0m at: [34mhttps://wandb.ai/DL-gr82/Meanest%20Teacher/runs/wsir3k7y[0m

------------------------------------------------------------
Sender: LSF System <lsfadmin@hpc.dtu.dk>
Subject: Job 27256234[2]: <lr[1-3]> in cluster <dcc> Done

Job <lr[1-3]> was submitted from host <n-62-27-20> by user <s194778> in cluster <dcc> at Tue Dec  2 21:36:28 2025
Job was executed on host(s) <4*n-62-20-10>, in queue <gpuv100>, as user <s194778> in cluster <dcc> at Tue Dec  2 22:10:46 2025
</zhome/f9/1/147385> was used as the home directory.
</zhome/f9/1/147385/02456-g82-dl-project> was used as the working directory.
Started at Tue Dec  2 22:10:46 2025
Terminated at Tue Dec  2 22:30:24 2025
Results reported at Tue Dec  2 22:30:24 2025

Your job looked like:

------------------------------------------------------------
# LSBATCH: User input
#!/bin/bash
# BSUB job array: submit with `bsub < scripts/run_lr_sweep.sh`
# Adjust learning rates in LR_VALUES below.
#BSUB -J lr[1-3]
#BSUB -q gpuv100
#BSUB -n 4
#BSUB -R "span[hosts=1]"
#BSUB -R "rusage[mem=10000]"
#BSUB -gpu "num=1"
# Time & logs
#BSUB -W 04:00
#BSUB -o /zhome/f9/1/147385/02456-g82-dl-project/hpc_logs/gcn_%J.out
#BSUB -e /zhome/f9/1/147385/02456-g82-dl-project/hpc_logs/gcn_%J.err

set -euo pipefail

module purge
module load python3/3.10.12
module load gcc
# module load cuda/12.1  # uncomment if needed
source "/zhome/f9/1/147385/my_venv/bin/activate"

BATCH_VALUES=(50 150 200)
BATCH=${BATCH_VALUES[$((LSB_JOBINDEX-1))]}

python3 src/run.py \
    trainer=advanced_gcn_trainer \
    model=advanced_gcn \
    dataset.init.batch_size_train=$BATCH \
    logger.name="A_gcn_MT_GraphNorm_batch${BATCH}" \
    "$@"


# LR_VALUES=(0.0001 0.0005 0.001 0.005 0.01)
# LR=${LR_VALUES[$((LSB_JOBINDEX-1))]}

# python3 src/run.py \
#     trainer=advanced_gcn_trainer \
#     model=advanced_gcn \
#     trainer.init.optimizer.lr=$LR \
#     logger.name="A_gcn_MT_GraphNorm_lr${LR}" \
#     "$@"

#  # Define the list of lambda_unsup values to sweep
# # # LAMBDA_VALUES=(0.001 0.005 0.01 0.05 0.1)
# LAMBDA_VALUES=(0.0001 0.001 0.005 0.01 0.05 0.1)
# LAMBDA=${LAMBDA_VALUES[$((LSB_JOBINDEX-1))]}

# # for LAMBDA in "${LAMBDA_VALUES[@]}"; do
# #     echo "Running experiment with lambda_unsup = $LAMBDA"

(... more ...)
------------------------------------------------------------

Successfully completed.

Resource usage summary:

    CPU time :                                   2917.00 sec.
    Max Memory :                                 4873 MB
    Average Memory :                             4315.50 MB
    Total Requested Memory :                     40000.00 MB
    Delta Memory :                               35127.00 MB
    Max Swap :                                   -
    Max Processes :                              18
    Max Threads :                                82
    Run time :                                   1196 sec.
    Turnaround time :                            3236 sec.

The output (if any) is above this job summary.



PS:

Read file </zhome/f9/1/147385/02456-g82-dl-project/hpc_logs/gcn_27256234.err> for stderr output of this job.

dataset:
  dataset_name: qm9
  num_outputs: 1
  init:
    _target_: qm9.QM9DataModule
    data_augmentation: false
    name: qm9
    target: 2
    data_dir: ./data
    batch_size_train: 200
    batch_size_inference: 2048
    num_workers: 4
    splits:
    - 0.72
    - 0.08
    - 0.1
    - 0.1
    seed: 0
    subset_size: null
trainer:
  method: semi-supervised-ensemble
  train:
    total_epochs: 400
    validation_interval: 10
  init:
    _target_: trainer.SemiSupervisedEnsemble
    lambda_max: 0.05
    supervised_criterion:
      _target_: torch.nn.MSELoss
    optimizer:
      _target_: torch.optim.AdamW
      _partial_: true
      lr: 0.005
      weight_decay: 0.01
    scheduler:
      _target_: torch.optim.lr_scheduler.StepLR
      _partial_: true
      step_size: 10
      gamma: 0.9
logger:
  _target_: logger.WandBLogger
  group: ${dataset.dataset_name}
  name: A_gcn_MT_GraphNorm_batch200
  job_type: test
  entity: DL-gr82
  project_name: Meanest Teacher
  disable: false
  local_dir: ./logs
model:
  name: advanced_gcn
  init:
    _target_: models.advanced_GCN
    _partial_: false
    num_node_features: 11
    hidden_channels: 128
    dropout: 0.05
    use_layer_norm: false
    use_residual: true
    use_kaiming_init: false
num_models: 1
seed: 0
device: unset
force_deterministic: false
debug_mode: false
result_dir: ./results
compile_model: false

QM9 dataset loaded with 10466 labeled, 94198 unlabeled, 13083 validation, and 13084 test samples.
Batch sizes: labeled=200, unlabeled=200
Supervised batches: 53, Unsupervised batches: 471
tensor(0., device='cuda:0')
tensor(0., device='cuda:0', grad_fn=<MeanBackward0>)
[1;34mwandb[0m: 
[1;34mwandb[0m: 🚀 View run [33mA_gcn_MT_GraphNorm_batch200[0m at: [34mhttps://wandb.ai/DL-gr82/Meanest%20Teacher/runs/3rr9r8hr[0m

------------------------------------------------------------
Sender: LSF System <lsfadmin@hpc.dtu.dk>
Subject: Job 27256234[3]: <lr[1-3]> in cluster <dcc> Done

Job <lr[1-3]> was submitted from host <n-62-27-20> by user <s194778> in cluster <dcc> at Tue Dec  2 21:36:28 2025
Job was executed on host(s) <4*n-62-20-15>, in queue <gpuv100>, as user <s194778> in cluster <dcc> at Tue Dec  2 22:32:01 2025
</zhome/f9/1/147385> was used as the home directory.
</zhome/f9/1/147385/02456-g82-dl-project> was used as the working directory.
Started at Tue Dec  2 22:32:01 2025
Terminated at Tue Dec  2 22:46:20 2025
Results reported at Tue Dec  2 22:46:20 2025

Your job looked like:

------------------------------------------------------------
# LSBATCH: User input
#!/bin/bash
# BSUB job array: submit with `bsub < scripts/run_lr_sweep.sh`
# Adjust learning rates in LR_VALUES below.
#BSUB -J lr[1-3]
#BSUB -q gpuv100
#BSUB -n 4
#BSUB -R "span[hosts=1]"
#BSUB -R "rusage[mem=10000]"
#BSUB -gpu "num=1"
# Time & logs
#BSUB -W 04:00
#BSUB -o /zhome/f9/1/147385/02456-g82-dl-project/hpc_logs/gcn_%J.out
#BSUB -e /zhome/f9/1/147385/02456-g82-dl-project/hpc_logs/gcn_%J.err

set -euo pipefail

module purge
module load python3/3.10.12
module load gcc
# module load cuda/12.1  # uncomment if needed
source "/zhome/f9/1/147385/my_venv/bin/activate"

BATCH_VALUES=(50 150 200)
BATCH=${BATCH_VALUES[$((LSB_JOBINDEX-1))]}

python3 src/run.py \
    trainer=advanced_gcn_trainer \
    model=advanced_gcn \
    dataset.init.batch_size_train=$BATCH \
    logger.name="A_gcn_MT_GraphNorm_batch${BATCH}" \
    "$@"


# LR_VALUES=(0.0001 0.0005 0.001 0.005 0.01)
# LR=${LR_VALUES[$((LSB_JOBINDEX-1))]}

# python3 src/run.py \
#     trainer=advanced_gcn_trainer \
#     model=advanced_gcn \
#     trainer.init.optimizer.lr=$LR \
#     logger.name="A_gcn_MT_GraphNorm_lr${LR}" \
#     "$@"

#  # Define the list of lambda_unsup values to sweep
# # # LAMBDA_VALUES=(0.001 0.005 0.01 0.05 0.1)
# LAMBDA_VALUES=(0.0001 0.001 0.005 0.01 0.05 0.1)
# LAMBDA=${LAMBDA_VALUES[$((LSB_JOBINDEX-1))]}

# # for LAMBDA in "${LAMBDA_VALUES[@]}"; do
# #     echo "Running experiment with lambda_unsup = $LAMBDA"

(... more ...)
------------------------------------------------------------

Successfully completed.

Resource usage summary:

    CPU time :                                   2132.78 sec.
    Max Memory :                                 4937 MB
    Average Memory :                             4343.44 MB
    Total Requested Memory :                     40000.00 MB
    Delta Memory :                               35063.00 MB
    Max Swap :                                   -
    Max Processes :                              18
    Max Threads :                                79
    Run time :                                   859 sec.
    Turnaround time :                            4192 sec.

The output (if any) is above this job summary.



PS:

Read file </zhome/f9/1/147385/02456-g82-dl-project/hpc_logs/gcn_27256234.err> for stderr output of this job.

[1;34mwandb[0m: 
[1;34mwandb[0m: 🚀 View run [33mA_gcn_MT_GraphNorm_batch50[0m at: [34mhttps://wandb.ai/DL-gr82/Meanest%20Teacher/runs/cx41rtoh[0m

------------------------------------------------------------
Sender: LSF System <lsfadmin@hpc.dtu.dk>
Subject: Job 27256234[1]: <lr[1-3]> in cluster <dcc> Done

Job <lr[1-3]> was submitted from host <n-62-27-20> by user <s194778> in cluster <dcc> at Tue Dec  2 21:36:28 2025
Job was executed on host(s) <4*n-62-20-10>, in queue <gpuv100>, as user <s194778> in cluster <dcc> at Tue Dec  2 22:10:15 2025
</zhome/f9/1/147385> was used as the home directory.
</zhome/f9/1/147385/02456-g82-dl-project> was used as the working directory.
Started at Tue Dec  2 22:10:15 2025
Terminated at Tue Dec  2 23:07:07 2025
Results reported at Tue Dec  2 23:07:07 2025

Your job looked like:

------------------------------------------------------------
# LSBATCH: User input
#!/bin/bash
# BSUB job array: submit with `bsub < scripts/run_lr_sweep.sh`
# Adjust learning rates in LR_VALUES below.
#BSUB -J lr[1-3]
#BSUB -q gpuv100
#BSUB -n 4
#BSUB -R "span[hosts=1]"
#BSUB -R "rusage[mem=10000]"
#BSUB -gpu "num=1"
# Time & logs
#BSUB -W 04:00
#BSUB -o /zhome/f9/1/147385/02456-g82-dl-project/hpc_logs/gcn_%J.out
#BSUB -e /zhome/f9/1/147385/02456-g82-dl-project/hpc_logs/gcn_%J.err

set -euo pipefail

module purge
module load python3/3.10.12
module load gcc
# module load cuda/12.1  # uncomment if needed
source "/zhome/f9/1/147385/my_venv/bin/activate"

BATCH_VALUES=(50 150 200)
BATCH=${BATCH_VALUES[$((LSB_JOBINDEX-1))]}

python3 src/run.py \
    trainer=advanced_gcn_trainer \
    model=advanced_gcn \
    dataset.init.batch_size_train=$BATCH \
    logger.name="A_gcn_MT_GraphNorm_batch${BATCH}" \
    "$@"


# LR_VALUES=(0.0001 0.0005 0.001 0.005 0.01)
# LR=${LR_VALUES[$((LSB_JOBINDEX-1))]}

# python3 src/run.py \
#     trainer=advanced_gcn_trainer \
#     model=advanced_gcn \
#     trainer.init.optimizer.lr=$LR \
#     logger.name="A_gcn_MT_GraphNorm_lr${LR}" \
#     "$@"

#  # Define the list of lambda_unsup values to sweep
# # # LAMBDA_VALUES=(0.001 0.005 0.01 0.05 0.1)
# LAMBDA_VALUES=(0.0001 0.001 0.005 0.01 0.05 0.1)
# LAMBDA=${LAMBDA_VALUES[$((LSB_JOBINDEX-1))]}

# # for LAMBDA in "${LAMBDA_VALUES[@]}"; do
# #     echo "Running experiment with lambda_unsup = $LAMBDA"

(... more ...)
------------------------------------------------------------

Successfully completed.

Resource usage summary:

    CPU time :                                   7080.00 sec.
    Max Memory :                                 5102 MB
    Average Memory :                             4776.96 MB
    Total Requested Memory :                     40000.00 MB
    Delta Memory :                               34898.00 MB
    Max Swap :                                   -
    Max Processes :                              18
    Max Threads :                                82
    Run time :                                   3412 sec.
    Turnaround time :                            5439 sec.

The output (if any) is above this job summary.



PS:

Read file </zhome/f9/1/147385/02456-g82-dl-project/hpc_logs/gcn_27256234.err> for stderr output of this job.

